{
  "protocolVersion": "jeden.behavior-check.v2",
  "checkVersion": 2,
  "fixtureDigest": "bbbbbbbbbbbbbbbbbbbbbbbbbbbbbbbbbbbbbbbbbbbbbbbbbbbbbbbbbbbbbbbb",
  "commandOrScenarioId": "stale-evidence-fixture",
  "startedAt": 10,
  "finishedAt": 20,
  "expiresAt": 21,
  "attempts": [
    {
      "attempt": 1,
      "startedAt": 10,
      "finishedAt": 20,
      "outcome": "passed",
      "detail": "valid execution whose evidence validity has elapsed"
    }
  ],
  "outcome": "passed"
}
